{"id":"TXT-GRC-001","type":"text","title":"Hesiod's Theogony","status":"active","version":"1.0.0","tradition":"Archaic Greek theogony","language":"Ancient Greek","date_range":"traditionally placed around the late 8th or early 7th century BCE","description":"Poetic account of divine genealogies and cosmic succession attributed to Hesiod.","civilization_ids":["CIV-GRC-001"],"region_ids":["REG-AEG-001"],"passage_ids":[],"source_ids":[],"notes":"The work is a theogony and genealogy; comparisons with Genesis require explicit criteria rather than assuming equivalence."}