{"id":"TXT-MES-001","type":"text","title":"Enuma Elish","status":"active","version":"1.0.0","tradition":"Babylonian creation epic","language":"Akkadian","date_range":"first millennium BCE manuscript tradition; composition commonly associated with the late second millennium BCE","description":"Babylonian creation epic describing divine conflict and cosmic ordering, with Marduk playing the central role in the surviving narrative.","civilization_ids":["CIV-MES-001"],"region_ids":["REG-MES-001"],"passage_ids":[],"source_ids":[],"notes":"This is one Mesopotamian creation tradition and should not be generalized to every Mesopotamian culture."}