{"id":"TXT-GEN-001","type":"text","title":"Genesis","status":"active","version":"1.0.0","tradition":"Hebrew Bible / Old Testament","language":"Hebrew with later translation traditions","date_range":"ancient composition and transmission; exact dating debated","description":"Canonical text record for Genesis, with GEI research initially focusing on Genesis 1 and the KJV wording used in the project.","civilization_ids":[],"region_ids":["REG-LEV-001"],"passage_ids":[],"source_ids":[],"notes":"Textual, linguistic, historical, and interpretive claims must be sourced separately."}