{"id":"TXT-EGY-001","type":"text","title":"Heliopolitan Creation Tradition","status":"active","version":"1.0.0","tradition":"Ancient Egyptian Heliopolitan theology","language":"Egyptian","date_range":"attested in texts from the Old Kingdom onward; tradition developed over time","description":"Structured record for the Heliopolitan creation tradition, represented through multiple Egyptian textual sources rather than a single canonical creation text.","civilization_ids":["CIV-EGY-001"],"region_ids":["REG-NIL-001"],"passage_ids":[],"source_ids":[],"notes":"This record must not be treated as a single authored narrative or as representative of every Egyptian creation tradition."}